,ROPOLine,Task Order,Condom Adjusted Task Order,Country,RO Number,PO DO IO Number,Order Number,Prime Line Number,Status Name,TLP Indicator,Order Type,Fulfillment Method,Transportation Mode,Item Tracer Category,Product Category,Item ID,ProductName,UOM,Base Unit,Base Unit Multiplier,Country Registration Status,Item Volume,Item Volume UOM,Item Weight,Item Weight UOM,Health Element,D365 Health Element,D365 Funding Source,D365 Funding Source Detail,Estimated Lead Time in Days,Emergency Order,Manufacturer Name,Manufacturer Location,Manufacture CountryCountry of Origin,Supplier,Order Pick Up Country,Vendor Incoterm,Destination Incoterm,Unit Price,List Price,Ordered Quantity,Line Total,Shipped Quantity,QAquantity,Delivery Value,Total Actual Freight Costs,In Full (IFD),On Time (OTD),Between -14 and 14,Between -30 and 30,OTIF Categories,OTIF Between -14 and 14,OTIF Between -30 and 30,Average Days Late Binned,Average Days Late,Number of Shipments,Delivery Progress,Line Delivery Status,Agreed Delivery Date,Agreed Delivery Date Year,Agreed Delivery Date Year Month,Agreed Delivery Date Fiscal Year,Agreed Delivery Date Fiscal Quarter Year,Revised Agreed Delivery Date,Revised Agreed Delivery Date Year,Revised Agreed Delivery Date Year Month,Revised Agreed Delivery Date Fiscal Year,Revised Agreed Delivery Date Fiscal Quarter Year,Order Entry Date,Order Entry Date Year,Order Entry Date Year Month,Order Entry Date Fiscal Year,Order Entry Date Fiscal Quarter Year,Requested Delivery Date,Requested Delivery Date Year,Requested Delivery Date Year Month,Requested Delivery Date Fiscal Year,Requested Delivery Date Fiscal Quarter Year,Estimated Delivery Date,Estimated Delivery Date Year,Estimated Delivery Date Year Month,Estimated Delivery Date Fiscal Year,Estimated Delivery Date Fiscal Quarter Year,Latest Actual Delivery Date,Latest Actual Delivery Date Year,Latest Actual Delivery Date Year Month,Latest Actual Delivery Date Fiscal Year,Latest Actual Delivery Date Fiscal Quarter Year,RO Clarified Date,RO Sent Plan Fulfillment Date,RO Sent Sourcing RFX Event Date,Initial PSM Source Approval Date,Recipient Approval Date,USAID Approval Date,PO Released For Fulfillment Date,PO Released For Fulfillment Date Year,PO Released For Fulfillment Date Year Month,PO Released For Fulfillment Date Fiscal Year,PO Released For Fulfillment Date Fiscal Quarter Year,Committed Goods Available Date,Actual Goods Available Date,Actual Cargo Ready Date,QA Complete Date,Max Pick Up Date,Max Ship Date,Max Departure Date,Max Arrival Date,Order Cycle Time,RO on Hold - Client,RO on Hold - Recipient,RO on Hold – Pre-RFxPre-Allocation Stage,RO on Hold – Tech Package Stage,RO on Hold – Supply Planning,On Hold Pending PO Release,On Hold Pending RO Release,Line Item Total Dwell,RO Validation,Sourcing and Planning,USAID Approval,Process PODO,Manufacture,Pick Up,Deliver,Quality Assurance,Reason Code,Reason Text,Changed Field,Reason Code Duration
9558,RO10087187RO10087187_12,TO3,TO3,Uganda,RO10087187,RO10087187_1,RO10087187,2,Shipment Out For Delivery,GSC,Distribution Order,RDC,Sea,Implantable Contraceptives,Contraceptive Implants,100129GYV01S3LR,"Etonogestrel 68 mg/Rod, 1 Rod Implant, 1 Each                                                                                   ",UNT,Each,1.0,,0.00038889,CBM,0.0625,KGM             ,317MISSION,,,,,N,N.V. Organon,"Kloosterstraat 6, NL-5349 AB, Oss, Netherlands",NL,N.V. Organon,Belgium,,DDP,8.5,8.5,162504.0,1381284.0,162504.0,0.0,1381284.0,,Y,N,N,N,Not On Time In Full,Not On Time In Full,Not On Time In Full,<-14,-28358.0,1.0,0,Undelivered,"Mar 30, 2021",2021.0,2021-03,2021.0,2021-Q2,"Jan 1, 2099",2099.0,2099-01,2099.0,2099-Q2,"Oct 4, 2019",2019.0,2019-10,2020.0,2020-Q1,"Jun 30, 2020",2020.0,2020-06,2020.0,2020-Q3,"Apr 26, 2021",2021.0,2021-04,2021.0,2021 Q3,,,,,,,,"Dec 18, 2019","Apr 10, 2020","Apr 14, 2020","Apr 14, 2020","Feb 9, 2021",2021.0,2021-02,2021.0,2021-Q2,"Feb 12, 2021",,"Feb 12, 2021",,"Mar 8, 2021","Mar 18, 2021","Mar 18, 2021",,,0.0,0.0,0.0,0.0,0.0,0.0,0.0,0.0,,,0.0,301.0,3.0,24.0,,,AD016,"original ADD was 3/30. Goods were available on time but due to an ongoing OIG investigation of pdt leakage in Uganda, this order was re-directed to BE RDC. PSM was advised by USAID DC to hold off o/ this shipment, and then instructed to ship on 2/9",AGREED_DELIVERY_DATE,28401.0
11472,RO100902223,TO3,TO3,Bangladesh,RO10090222,,RO10090222,3,Order Confirmed,GSC,,RDC,Air,Injectable Contraceptives,Injectable Contraceptives,100031GNE06D03X,"Depot (SC) Medroxyprogesterone Acetate 104 mg/0.65 mL, Pre-Filled Uniject Device, 1 Syringe                                     ",UNT,Syringe,1.0,,7.5e-05,CBM,0.00521,KGM             ,317MISSION,,,,245.0,N,Pfizer Manufacturing Belgium NV,"API (7000 Portage Rd, Kalamazoo, MI 49001), Rijksweg 12, B-2870, Puurs, Belgium",BE,Pfizer Overseas LLC,Belgium,,DAP,0.85,0.85,43000.0,36550.0,,0.0,,,,,,,,,,,,,0,Undelivered,"Jan 18, 2021",2021.0,2021-01,2021.0,2021-Q2,"Jan 1, 2099",2099.0,2099-01,2099.0,2099-Q2,"Feb 27, 2020",2020.0,2020-02,2020.0,2020-Q2,"Dec 31, 2020",2020.0,2020-12,2021.0,2021-Q1,,,,,,,,,,,,,,"May 14, 2020","May 14, 2020","May 18, 2020",,,,,,,,,,,,,,,0.0,0.0,0.0,0.0,0.0,0.0,0.0,0.0,,,4.0,,,,,,AD030,"Current RO prioritized by CPG until ~Jan2021 for BE-API, alternatively, US-API can be imported only after registration notification needed to import US-API, submission planned in Dec.",AGREED_DELIVERY_DATE,28472.0
21077,RO10111114PO100173831,TO3,TO3,Mozambique,RO10111114,PO10017383,PO10017383,1,Shipment Arrived at Port of Discharge,GSC,Purchase Order,Direct Drop,Sea,Injectable Contraceptives,Injectable Contraceptives,100125GPX01S27K,"Depot (IM) Medroxyprogesterone Acetate 150 mg/mL (1 mL) Vial, w/ AD Syringe, Burn Boxes, 1 Each                                 ",UNT,Each,1.0,,0.00011999999999999999,CBM,0.01845,KGM             ,317MISSION,,,,140.0,N,"PT Tunggal Idman Abdi (Supplier, Missionpharma).","PT Tunggal Idman Abdi (Hormone Plant 2), Jalan Jendral Ahmad Yani No.7, Jakarta Timur 13230. Indonesia",ID,Missionpharma A/S,,FCA,DAP,0.7759999999999999,0.78,744500.0,577732.0,744500.0,0.0,577732.0,,Y,N,N,N,Not On Time In Full,Not On Time In Full,Not On Time In Full,<-14,-28358.0,1.0,0,Undelivered,"Mar 31, 2021",2021.0,2021-03,2021.0,2021-Q2,"Jan 1, 2099",2099.0,2099-01,2099.0,2099-Q2,"Sep 22, 2020",2020.0,2020-09,2020.0,2020-Q4,"Mar 31, 2021",2021.0,2021-03,2021.0,2021-Q2,"Mar 31, 2021",2021.0,2021-03,2021.0,2021 Q2,,,,,,"Oct 9, 2020",,"Oct 13, 2020","Nov 2, 2020","Nov 2, 2020","Nov 2, 2020","Dec 1, 2020",2020.0,2020-12,2021.0,2021-Q1,"Dec 11, 2020","Dec 10, 2020","Dec 13, 2020",,"Feb 8, 2021","Feb 12, 2021","Feb 12, 2021",,,0.0,0.0,0.0,0.0,0.0,0.0,0.0,0.0,21.0,20.0,0.0,29.0,9.0,60.0,,,AD070,"This order was impacted by covid-19 (logistics), ADD is put at 1/1/2099 before being aligned with actual delivery date.",AGREED_DELIVERY_DATE,28400.0
21410,RO100941092,TO3,TO3,Uganda,RO10094109,,RO10094109,2,Order Confirmed,GSC,,RDC,Sea,Injectable Contraceptives,Injectable Contraceptives,100031GNE06D03X,"Depot (SC) Medroxyprogesterone Acetate 104 mg/0.65 mL, Pre-Filled Uniject Device, 1 Syringe                                     ",UNT,Syringe,1.0,,7.5e-05,CBM,0.00521,KGM             ,317MISSION,,,,203.0,N,Pfizer Manufacturing Belgium NV,"API (7000 Portage Rd, Kalamazoo, MI 49001), Rijksweg 12, B-2870, Puurs, Belgium",BE,Pfizer Overseas LLC,Belgium,,DDP,0.85,0.85,463000.0,393550.0,,0.0,,,,,,,,,,,,,0,Undelivered,"Dec 17, 2020",2020.0,2020-12,2021.0,2021-Q1,"Jan 1, 2099",2099.0,2099-01,2099.0,2099-Q2,"Apr 21, 2020",2020.0,2020-04,2020.0,2020-Q3,"Nov 30, 2020",2020.0,2020-11,2021.0,2021-Q1,,,,,,,,,,,"Apr 29, 2020",,"May 5, 2020","May 26, 2020","May 27, 2020","May 28, 2020",,,,,,,,,,,,,,,0.0,0.0,0.0,0.0,0.0,0.0,0.0,0.0,8.0,28.0,1.0,,,,,,AD030,"registration notificaiton needed, submission planned in Dec.UG will then be prioritized for BE-API upon regulatory and GHSC-QA approval. Current RO deprioritized by CPG until ~Q2021",AGREED_DELIVERY_DATE,28504.0
26040,RO10082159PO100173771,TO3,TO3,Mozambique,RO10082159,PO10017377,PO10017377,1,Shipment Delivered,GSC,Purchase Order,Direct Drop,Sea,Injectable Contraceptives,Injectable Contraceptives,100125GPX01S27K,"Depot (IM) Medroxyprogesterone Acetate 150 mg/mL (1 mL) Vial, w/ AD Syringe, Burn Boxes, 1 Each                                 ",UNT,Each,1.0,,0.00011999999999999999,CBM,0.01845,KGM             ,317MISSION,,,,133.0,N,"PT Tunggal Idman Abdi (Supplier, Missionpharma).","PT Tunggal Idman Abdi (Hormone Plant 2), Jalan Jendral Ahmad Yani No.7, Jakarta Timur 13230. Indonesia",ID,Missionpharma A/S,,FCA,DAP,0.7759999999999999,0.78,744000.0,577344.0,744000.0,0.0,577344.0,,Y,N,N,N,Not On Time In Full,Not On Time In Full,Not On Time In Full,<-14,-28367.0,1.0,2,Delivered - Early,"Mar 31, 2021",2021.0,2021-03,2021.0,2021-Q2,"Jan 1, 2099",2099.0,2099-01,2099.0,2099-Q2,"Sep 11, 2019",2019.0,2019-09,2019.0,2019-Q4,"Mar 31, 2021",2021.0,2021-03,2021.0,2021-Q2,"Mar 24, 2021",2021.0,2021-03,2021.0,2021 Q2,"May 3, 2021",2021.0,2021-05,2021.0,2021-Q3,,"Sep 12, 2019","Sep 19, 2019","Oct 29, 2020","Oct 30, 2020","Nov 2, 2020","Dec 1, 2020",2020.0,2020-12,2021.0,2021-Q1,"Dec 11, 2020","Dec 10, 2020","Dec 13, 2020",,"Feb 9, 2021","Feb 12, 2021","Feb 12, 2021","May 3, 2021",601.0,0.0,0.0,0.0,0.0,0.0,0.0,0.0,0.0,8.0,407.0,3.0,29.0,9.0,61.0,83.0,,AD070,"This order was impacted by covid-19 (logistics), ADD is put at 1/1/2099 before being aligned with actual delivery date.",AGREED_DELIVERY_DATE,28400.0
